Multicolor Flat-Panel Display Using Tunable Birefringence Filters,L. Stuart III,,Phase I,Displaytech Inc.,49743,,JSC
Multiple-Access Communication Hybrid Simulation,Thomas Linnenbrink,,Phase I,Q-Dot Inc,49993,,JSC
Organic Removal Module for Ultra-Pure Water Recycle Systems,Misha Plam,,Phase I,Sievers Instruments Inc,50000,,MSFC
An Automatic Scheduling Assistant for the NASA Space Station,Mohsen Pazirandeh,,Phase I,Innovative Research Inc,46267,,JSC
Polarimetry-Based SAR-Shape from Shading Terrain Reconstruction,Thomas Pyper,,Phase I,Vextra Corp,49998,,GSFC
Triggering of Lightning by Launch Vehicles During Ascent,Rodney Perala,,Phase I,Electromagnetic Applications,49685,,KSC
Reversible Oxide Chemical Compressor for Sensor Cryocooling,Franklin Lynch,,Phase I,Hydrogen Consultants Inc,48552,,JPL
Centerline Imaging System for End-Effector Tools,Nancy Lord,,Phase I,Olis Engineering,37979,,MSFC
