Welding Technology,R. Joel Barnett,,Phase I,Mid-South Engineering Inc,50000,,MSFC
Quick Look Modal Testing Of Flexible Structures,Daniel Inman,,Phase I,DSM Inc,50000,,JSC
Pressure-Time Flow Measurement,Arby Dickert,,Phase I,Windrock Inc,50000,,MSFC
Alternative Illumination Technologies For The Human Habitation Of Space,Raymond Mullican,,Phase I,McGown Mullican & Dunn,49624,,MSFC
Neural Networks For Real Time Data Evaluation In Remote Sensing Instrumentation,Craig Harston,,Phase I,Computer Applications Service,50000,,SSC
Alternative Illumination Technologies for Human Habitation of Space,Raymond Mullican,,Phase II,McGown Mullican & Dunn,419066,,MSFC
Quick-Look Modal Testing of Flexible Structures,Daniel Inman,,Phase II,DSM Inc,446146,,JSC
