High-Temperature Piezo- and Ferro-Electric Liquid Crystal Polymers for Wind Tunnel Use,L. Stuart III,,Phase I,Displaytech Inc.,69743,,LaRC
Highly Nonlinear Optical Ferroelectric Liquid-Crystal Polymers,L. Stuart Iii,,Phase I,Displaytech Inc.,69995,,GRC
Universal Spatial Light Modulator,L. Stuart Iii,,Phase I,Displaytech Inc.,68099,,ARC
Aircraft Wake Tracking Analysis,Robert Huffaker,,Phase I,Coherent Technologies Inc.,69116,,LaRC
Continuous Monitoring of Dissolved Oxygen in Spacecraft Water Recycling Systems,Eileen Sammells,,Phase I,Eltron Research & Development Inc.,69999,,ARC
Buffering and Control of pH in Zeoponic Plant Growth Media,Richard Andrews,,Phase I,Boulder Innovative Technologies Inc,61900,,JSC
Robust Fiber-Optic Communication System for Harsh Aerospace Environments,Greg Olbright,,Phase I,Photonics Research Inc,69967,,GSFC
Parallel Optical Backplane Interconnections for Avionics and High-Performance Computers,Greg Olbright,,Phase I,Photonics Research Inc,69968,,GSFC
Programmable Incubator for Autonomous Support of Living Cells in Microgravity,William Urick Iii,,Phase I,Synergetics Intl Inc,70000,,HQ
Terrain Analysis and Visualization Workstation,Milan Karspeck,,Phase I,Telesis Corporation,68225,,JPL
Real-Time Image Compression System for Use in Autonomous Navigation,David Gardner,,Phase I,Silicon Mountain Design Inc,69921,,JPL
Thermal and Fluid Simulation for Multiple Constituents and Disciplines,Brent Cullimore,,Phase I,Cullimore & Ring Technologies Inc.,70000,,JSC
Low-Altitude-Wind Sensor System,David Doyle,,Phase I,WELS Research Corp,68740,,KSC
Thermal Radiation Analyzer for CAD Systems,Brent Cullimore,,Phase I,Cullimore & Ring Technologies Inc.,70000,,MSFC
Hypercontexts for Human-Systems Standards and Related Multimedia Information in Design of Spacecraft Interiors,Nancy Dagle,,Phase I,Johnson Engineering Corp,68041,,JSC
Catalytic Oxidtion of Halogenated Hydrocarbons,Michael Karpuk,,Phase I,TDA Research Inc.,70000,,JSC
Real-Time Remote-Sensing Air Temperature Radiometer for High-Speed Aircraft,Donald Rottner,,Phase I,Ophir Corp,68179,,ARC
Universal Spatial Light Modulator,Mark Handschy,,Phase II,Displaytech Inc.,595929,,ARC
Wind-Field and Wind-Shear Detection Using Random-Modulated Continuous-Wave Lidar and Edge Techniques,Donald Rottner,,Phase II,Ophir Corp,600000,,GSFC
Real-Time Remote-Sensing Air Temperature Radiometer for High-Speed Aircraft,Donald Rottner,,Phase II,Ophir Corp,598717,,AFRC
Employing Hypermedia and the Information Superhighway to Enhance Use of Human Factors in Space-Based Design,Nancy Dagle,,Phase II,Johnson Engineering Corp,584020,,JSC
Catalytic Oxidation of Halogenated Hydrocarbons,Michael Karpuk,,Phase II,TDA Research Inc.,586815,,JSC
Scanner Signal Processor and System Development and Integration of an Optical Air Turbulence Sensor,Robert Huffaker,,Phase II,Coherent Technologies Inc.,599998,,LaRC
Thermal Radiation Analyzer for CAD Systems,Brent Cullimore,,Phase II,Cullimore & Ring Technologies Inc.,594516,,MSFC
Aircraft Wake Tracking Analysis,Robert Huffaker,,Phase II,Coherent Technologies Inc.,599914,,LaRC
Wind-Field and Wind-Shear Detection Using Random-Modulated Continuous-Wave Lidar and Edge Techniques,Donald Rottner,,Phase I,Ophir Corp,69410,,GSFC
Solid-State Lidar for Monitoring Turbulent Air Motion,Robert Huffaker,,Phase I,Coherent Technologies Inc.,69905,,LaRC
Programmable High-Resolution High-Speed Digital Video Camera,Thomas Linnenbrink,,Phase I,Q-Dot Inc,69954,,GRC
Advanced Zeoponic Plant Growth Media Application Systems and Production Processes for Space Environmental Life Support Systems and Commerical Horticulture,Richard Andrews,,Phase II,Boulder Innovative Technologies Inc,600000,,KSC
