Laser Search And Rescue,Thomas Ory,,Phase I,Daedalus Enterprises Inc,69974,,GSFC
Ultracapacitors Based On High-Surface-Area Nitride/Carbide Electrodes,Maria Thompson,,Phase I,T/J Technologies Inc.,69728,,MSFC
Microgravity Microaccelerometer System,James Rice,,Phase I,Canopus Products Inc,69555,,GRC
Automated Rodent In-Vivo Injection And Sampling Workstation,Thomas Hunt,,Phase I,Advanced Modular Power Systems Inc,69100,,HQ
A Miniature Portable Physiological Measurement And Analysis System,Heidi Jacobus,,Phase I,Cybernet Systems Corporation,69938,,JSC
Large-Format Digital Multispectral Camera,Thomas Ory,,Phase I,Daedalus Enterprises Inc,69972,,ARC
Large-Format Digital Multispectral Camera,Charles Stanich,,Phase II,Daedalus Enterprises Inc,599931,,ARC
A Miniature Portable Physiological Measurement And Analysis System,Heidi Jacobus,,Phase II,Cybernet Systems Corporation,599981,,JSC
Laser Search and Rescue System,Charles Stanich,,Phase II,Daedalus Enterprises Inc,698573,,GSFC
DIFFERENTIATED UNIVERSAL END EFFECTOR,RONALD MEYER,,Phase I,Aeromover Systems Corp,99719,Small Business Technology Transfer,LaRC
A LOW-COST HIGH-PERFORMANCE VISUAL-AUDITORY-TACTILE VIRTUAL REALITY TRAINER,HEIDI JACOBUS,,Phase I,Cybernet Systems Corporation,98877,Small Business Technology Transfer,LaRC
AUTOMATED CAPTURE OF TECHNICAL MANUALS INTO IETM FORMAT FOR ELECTRONIC REVIEW AND DISTRIBUTION,HEIDI JACOBUS,,Phase I,Cybernet Systems Corporation,95291,Small Business Technology Transfer,GSFC
DIFFERENTIATED UNIVERSAL END EFFECTOR,RONALD MEYER,,Phase II,Aeromover Systems Corp,498079,Small Business Technology Transfer,LaRC
Micro-Inertial Momentum Sphere Stabilizers,Heidi Jacobus,,Phase I,Cybernet Systems Corporation,69605,,JPL
Graphics Sensors And Planning For Robotics,Heidi Jacobus,,Phase I,Cybernet Systems Corporation,69320,,JPL
High Energy and Power Density Ultracapacitors,Maria Thompson,,Phase II,T/J Technologies Inc.,600000,,MSFC
