Wave Turbine Engines: Improvements to an Existing Wave Turbine Test Platform,Robert Carroll,carrolsal@aol.com,Phase I,Unistry Assoc Inc,69958,,GRC
Rock Driller,Thomas Peterson,Tmpeter@AOL.com,Phase I,Cybersonics,62656,,JPL
"Compliant Pad Bonding for Space Shuttle Evaporator 					Furnace",Meeta Pherwani,khatri@icdc.com,Phase I,General Systems Co,69883,,GSFC
Low Noise/Thermal Signature Electronics for Precision Space Interferometry,Karla Sexton,karla@ptdprolog.net,Phase I,EMF Technologies Inc,68564,,JPL
Force-Output Microactuator For Precision Active Optics incorporating a Passive Thermal Release Lockdown Mechanism,Karla Sexton,karla@ptdprolog.net,Phase I,EMF Technologies Inc,68895,,GSFC
Thermal Control Using Multi-Spectral Switching,Kelly Reuter,wbiter@comcat.com,Phase I,Sensortex Inc,70000,,GSFC
Flexible Lightweight Radiator for an Inflatable Mars Spacecraft,Donald Ernst,rhoover@thermacore.com,Phase I,k Technology a division of Thermacore Inc.,69975,,JSC
Ceramic Matrix Composites for Spacecraft Propulsion,Kent Buesking,buesking@ix.netcom.com,Phase I,Materials Research and Design Inc.,69993,,GRC
Vibrostatic Buffeting Alleviation,Robert Coppola,karla@ptdprolog.net,Phase I,EMF Technologies Inc,69464,,LaRC
Flexible Lightweight Radiator for an Inflatable Mars Spacecraft,Donald Ernst,rhoover@thermacore.com,Phase II,k Technology a division of Thermacore Inc.,596870,,JSC
Thermal Control Using Multi-Spectral Switching,Kelly Reuter,wbiter@comcat.com,Phase II,Sensortex Inc,600000,,GSFC
Rock Driller,Thomas Peterson,Tmpeter@AOL.com,Phase II,Cybersonics,584183,,JPL
Piezoelectric Microdrive for NDE Applications,Karla Sexton,,Phase I,EMF Technologies Inc,99824,Small Business Technology Transfer,LaRC
