Sonic Pump Automation Robot Technology Application (SPARTA),Eric Rice,ricee@orbitec.com,Phase I,Orbital Technologies Corporation,70000,,MSFC
Hydrogen Magnetic Liquifier (HML),Eric Rice,ricee@orbitec.com,Phase I,Orbital Technologies Corporation,70000,,KSC
Solid Hydrogen In Liquid Helium for HEDM Applications,Eric Rice,ricee@orbitec.com,Phase I,Orbital Technologies Corporation,70000,,GRC
Aerodynamic Fluid Physics Research Facility (AFPRF),Eric Rice,ricee@orbitec.com,Phase I,Orbital Technologies Corporation,70000,,GRC
Regenerable Seed Plugs from Formed Plant Fiber,Eric Rice,ricee@orbitec.com,Phase I,Orbital Technologies Corporation,70000,,KSC
Sensory Activated Stimulation (SAS) System,Eric Rice,ricee@orbitec.com,Phase I,Orbital Technologies Corporation,70000,,ARC
Regenerable Seed Plugs from Formed Plant Fiber,Eric Rice,ricee@orbitec.com,Phase II,Orbital Technologies Corporation,600000,,KSC
Aerodynamic Fluid Physics Research Facility (AFPRF),Eric Rice,ricee@orbitec.com,Phase II,Orbital Technologies Corporation,600000,,GRC
