A Discrete Event Simulation Model for Spaceport Operations (SPACESIM),Mike Nevins,mnevins@nevinssoftware.com,Phase I,NEVINS SOFTWARE INC.,70000,,KSC
High Emissivity Protective Cerablak Coatings for Metallic TPS,John Rechner,jrechner@atfinet.com,Phase I,Applied Thin Films Inc,69999.92,,LaRC
A Discrete Event Simulation Model for Spaceport Operations (SPACESIM),Mike Nevins,mnevins@nevinssoftware.com,Phase II,NEVINS SOFTWARE INC.,600000,,KSC
High Emissivity Protective Cerablak Coatings for Metallic TPS,John Rechner,jrechner@atfinet.com,Phase II,Applied Thin Films Inc,599999.94,,LaRC
Ultra-large Solar Sail Technology,DAVID CARROLL,,Phase I,CU Aerospace LLC,99918,Small Business Technology Transfer,MSFC
Intelligent Medical Systems for Aerospace Emergency Medical Services, ,,Phase I,Ibex Healthdata Systems,99977,Small Business Technology Transfer,ARC
Intelligent Medical Systems for Aerospace Emergency Medical Services, ,epler@ibexhealthdata.com,Phase II,Ibex Healthdata Systems,488925,Small Business Technology Transfer,ARC
Ultra Large Solar Sail Technology,DAVID CARROLL,carroll@cuaerospace.com,Phase II,CU Aerospace LLC,499938,Small Business Technology Transfer,MSFC
