High Power Electro-Optic Modulator for Space-Based Applications,Philip Battle,battle@advr-inc.com,Phase II,ADVR Inc.,599946,Science,GSFC
LiDAR and Hyperspectral Fusion for Landslide Hazard Detection,Robert Crabtree,crabtree@hyperspectives.net,Phase I,HyPerspectives Inc.,68987.49,Science,SSC
Automated Feature Extraction from Hyperspectral Imagery,David Opitz,opitz@vls-inc.com,Phase I,Visual Learning Systems Inc.,70000,Science,SSC
Concept of Operations Storyboarding Tool,Dermot O&#039;Halloran,dohall@sktcorp.com,Phase I,S&K Technologies Inc.,69447,Exploration Systems,JSC
High Power Electro-Optic Modulator for Space-Based Applications,Philip Battle,battle@advr-inc.com,Phase I,ADVR Inc.,69745.33,Science,GSFC
Automated Feature Extraction from Hyperspectral Imagery,James Blundell,sblundell@vls-inc.com,Phase II,Visual Learning Systems Inc.,600000,Science,SSC
Concept of Operations Storyboarding Tool,Arthur Molin,amolin@sktcorp.com,Phase II,S&K Technologies Inc.,542226,Exploration Systems,JSC
