Advanced Insulation Techniques for Cryogenic Tanks,George Satornino,gsatornino@sierralobo.com,Phase I,Sierra Lobo Inc.,99952.98,Exploration Systems,GRC
Spacesuit Sensing Data Display and Management System,Gradmon Boling,Grady.Boling@zin-tech.com,Phase I,ZIN Technologies Inc.,99999.51,Exploration Systems,GRC
Integrated Cognitive Assessment:  Combining Measurement System and Mission,Beth Barker,BBarker307@aol.com,Phase I,NTI Inc.,99982,Exploration Systems,JSC
Integrated Cognitive Assessment:  Combining Measurement System and Mission,Beth Barker,BBarker307@aol.com,Phase II,NTI Inc.,599970,Exploration Systems,JSC
Lightweight High Temperature Beta Gamma Alloy/Process Development for Disk and Blade Applications,John Gruenwald,jgruenwald@ues.com,Phase I,UES Inc.,99995.35,Aeronautics Research,GRC
Dual Polarization Multi-Frequency Antenna Array,Jerry Capozzi,capozzij@spectra-research.com,Phase I,Spectra Research Inc,99993.97,Science,JPL
Dual Polarization Multi-Frequency Antenna Array,Jerry Capozzi,capozzij@spectra-research.com,Phase II,Spectra Research Inc,599996,Science,JPL
