Autonomous Rendezvous and Docking Techniques,Charles Cohen,proposals@cybernet.com,Phase I,Cybernet Systems Corporation,69762,,MSFC
Implantable space-worthy batteryless biotelemetric monitor for animal studies,Nader Najafi,nader@mems-issys.com,Phase I,INTEGRATED SENSING SYSTEMS INC. (ISSYS),69999,,ARC
A Wireless Communications Platform for Implantable Microinstruments,Nader Najafi,nader@mems-issys.com,Phase I,INTEGRATED SENSING SYSTEMS INC. (ISSYS),69982.37,,ARC
Chronic Telemetric Biofluid Flow Monitoring Device,Nader Najafi,nader@mems-issys.com,Phase I,INTEGRATED SENSING SYSTEMS INC. (ISSYS),69990.28,,GRC
EGLEAN: A Modeling and Analysis Tool for Error-Tolerant Design,James Rosbe,rosbe@soartech.com,Phase I,Soar Technology Inc.,69911,,ARC
Chronic Telemetric Biofluid Flow Monitoring Device,Nader Najafi,nader@mems-issys.com,Phase II,INTEGRATED SENSING SYSTEMS INC. (ISSYS),599990,,GRC
