Fiber Optic Systems for Light Curing Rigidization of Inflatable Structures,Susan Switzer,adherenttech@comcast.net,Phase I,Adherent Technologies Inc.,69999,,LaRC
SmartTopo Intelligent Real-Time Topographic Information Collection System,Michael Abernathy,mike@landform.com,Phase I,Rapid Imaging Software Inc.,70000,,JSC
High Sensitivity Ethylene Sensor for Plant Health Monitoring,Alan Stanton,astanton@swsciences.com,Phase I,Southwest Sciences Inc.,69999.55,,ARC
Low-Power Formaldehyde Detector for Space Applications,Alan Stanton,astanton@swsciences.com,Phase I,Southwest Sciences Inc.,70000,,JSC
Actively Cooled Ceramic Composite Nozzle Material,Stuart Schwab,stschwab@thortech.biz,Phase I,THOR TECHNOLOGIES INC.,69361,,MSFC
Surface Micromachined Arrays of Transition-Edge Detectors,Robin Cantor,rcantor@starcryo.com,Phase I,STAR Cryoelectronics LLC,69999.03,,GSFC
Low-Power Formaldehyde Detector for Space Applications,Alan Stanton,astanton@swsciences.com,Phase II,Southwest Sciences Inc.,599957,,JSC
SmartTopo Intelligent Real-Time Topographic Information Collection System,MICHAEL ABERNATHY,mikea@landform.com,Phase II,Rapid Imaging Software Inc.,600000,,JSC
Actively Cooled Ceramic Composite Nozzle Material,Stuart Schwab,stschwab@thortech.biz,Phase II,THOR TECHNOLOGIES INC.,592336,,MSFC
