Bluetooth Wireless Wearable Modular Medical Instrumentation,Tom Hendrickson,thendrickson@ame-corp.com,Phase I,Advanced Medical Electronics Corporation,70000,,JSC
High Performance VCSEL for 1550 nm Optical Network,Jane Marks,marks@svta.com,Phase I,SVT Associates,69500,,GRC
Low Power High Speed Digital Signal Isolator,James Daughton,daughton@nve.com,Phase I,NVE Corporation ,70000,,JPL
Advanced Aircraft Parachute Recovery System,Mark Thomas,BRSMThomas@aol.com,Phase I,Ballistic Recovery Systems Inc,68571,,LaRC
Bluetooth Wireless Wearable Modular Medical Instrumentation,Tom Hendrickson,thendrickson@ame-corp.com,Phase II,Advanced Medical Electronics Corporation,600000,,JSC
Low Power High Speed Digital Signal Isolator,Richard George,dickg@nve.com,Phase II,NVE Corporation ,599999,,JPL
Advanced Aircraft Parachute Recovery System,Mark Thomas,mthomas@brsparachutes.com,Phase II,Ballistic Recovery Systems Inc,598694,,LaRC
