Non-Toxic Ionic Liquid Fuels for Exploration Applications,Eric Rice,knaufs@orbitec.com,Phase I,Orbital Technologies Corporation,100000,Exploration Systems,GRC
High Efficiency High Output Plastic Melt Waste Compactor (HEHO-PMWC),Thomas Crabb,johnsond@orbitec.com,Phase I,Orbital Technologies Corporation,100000,Exploration Systems,ARC
Advanced Carbothermal Electric Reactor,Eric Rice,knaufs@orbitec.com,Phase I,Orbital Technologies Corporation,100000,Exploration Systems,KSC
Non-Toxic Ionic Liquid Fuels for Exploration Applications,Eric Rice,knaufs@orbitec.com,Phase II,Orbital Technologies Corporation,600000,Exploration Systems,GRC
High Efficiency High Output Plastic Melt Waste Compactor (HEHO-PMWC),Thomas Crabb,crabbt@orbitec.com,Phase II,Orbital Technologies Corporation,600000,Exploration Systems,ARC
Advanced Carbothermal Electric Reactor,Eric Rice,knaufs@orbitec.com,Phase II,Orbital Technologies Corporation,600000,Exploration Systems,KSC
